,fname,text
0,,". Glia Digital Customer Service Technology for Financial Enterprises and Beyond      This website uses cookies. Learn more.Join Glia for the premier customer interaction event - DCS Summit 2023Learn MoreSolutionsBy KPISalesDrive more sales onlineCustomer ExperienceIncrease customer loyaltyModernize SupportEase customer effortBy functionDigital CentricI support customers onlinePhone CentricI support customers via phoneHome AgentsCustomer Service from AnywhereVideo BankingPersonalized & expert service at a distancePlatformservices & SECURITYNew apps. New features. New ways to create. It's everythingChannelLessFocus on the full customer engagementCoBrowsingObserve and collaboratively guide visitors on-screenSMSMake SMS part of a seamless digital experienceAI ManagementManage customer chatbots and virtual agent assistantsVoiceEngage via traditional phone or seamless OnScreen VoiceAppletsUnified agent desktop for efficiency and satisfactionVideo ChatBuild trust with face-to-face conversations onlineChatSecure live and bot-assisted messaging with collaborationWorkforce ManagementRight reps, right channels at the right timeservices WhiteGlove Customer SuccessOnboarding and customer guidanceSECURITYSecuritySecurity at the coreIndustriesBankingBring the personalized in-branch experience onlineCredit UnionsEnhance the member experienceFinTechRevolutionize customer communicationInsuranceImprove customer acquisition and satisfactionLendingSupport lender activitiesSmall Business BankingGuided lending and customer serviceCompanyAbout GliaWho's behind Digital-First Customer Service?Glia's PhilosophyCCHaMP - Because excellence is a verbDigital Customer Service DefinedThe what and why of DCSAwardsWinning digital-first service technologyNewsNews from and about GliaBlogEducation, information, postulationPartnersPartner With GliaContact UsReach out to usWe're Hiring!Join the teamDiversity, Equity, and InclusionLearn about our DEI ProgramResourcesCase StudiesGlia Digital Customer Service solutions in actionGuidesInteractive guides and infographicsEbooks & White PapersLight reading to advance your DCS knowledgeResource LibraryBetter understand how to improve your cx through our collection of resourcesVideosAnimated explainers, client testimonials and on-demand webcastsWe're HiringRequest a DemoWe're Hiring!Request a DemoExperienceGlia Call CenterSeamlessly blend Phone and your Digital Customer Service. Purpose-built for financial services.Learn MoreIntroducing Digital Customer ServiceRedefine How You Interact withCustomers MembersCustomersMembersPolicyholdersAgentsProspectsSee It in ActionUse Any ChannelStart the conversation anywhereSeamlessly TransitionTake the conversation everywhereCo-Pilot ConversationsGuide the customer along the wayAny ChannelUse Any ChannelStart the conversation anywhereSeamlessly TransitionAny ChannelSeamlessly TransitionTake the conversation everywhereCo-Pilot ConversationsSeamlessly TransitionCo-Pilot ConversationsGuide the customer along the waySeamless TransitionExperience Glia Call CenterLearn MoreIntroducing Digital Customer ServiceRedefine How You Interact withCustomers MembersCustomersMembersPolicyholdersAgentsProspectsSee It in ActionUse Any ChannelUse Any ChannelStart the conversation anywhereSeamlessly TransitionSeamlessly TransitionTake the conversation everywhereCo-Pilot ConversationsCo-Pilot ConversationsGuide the customer along the wayWhy Digital Customer Service?Serve Customers When, Where and How They Need itRetain CustomersCompanies with strong digital-first capabilities have an 89% customer retention rate - AberdeenPeople communicate digitally in their personal lives and expect the same from businesses. Serve them at their point of need and support them in the channels they desire to keep them coming back for more.Show...Don't TellReclaim 60% of would-be drop-offs and deflections.On-screen observation, along with persistent customer data that flows with the conversation, provides context so you can quickly understand customers’ needs and guide them past sticking points to success.Promote LoyaltyReduce customer effort for 20% improvement in Customer Satisfaction and Net Promoter Scores.Customers don't want to jump through hoops to get assistance. Reduce customer effort with personalized, intuitive service from intelligent virtual assistants and informed live agents.Boost EfficiencyOn-screen guidance can reduce average handle times by 18% or more.Eliminate needless customer and agent repetition, and remove ambiguity with CoBrowsing and screen pops to respond to client needs more efficiently.Glia Digital CustomerService PlatformSeamless On-Screen ExperiencesCoBrowsingChatVoiceVideo ChatSMSPhoneSocialAIGlia provides award-winning digital-first customer service technology that is reinventing how financial enterprises support their customers in a digital world.Who Uses Glia DigitalCustomer Service?Companies Embracing the CX of the Future""We’ve gone from having 20% digital engagements to over 50% in just a matter of five weeks using Glia.""Randy LambertPresident at Orion""We’ve all spoken with call centers before and know just how frustrating it can be. CoBrowsing has been an incredible help to our members.""Greg Smith Former President at PSECUGreg SmithFormer PSECU President""Members are only a call or click away from assistance, and with CoBrowsing, our agents can guide them online like never before”Managing DirectorOperational Efficiency""Productivity improved by 18%, enabling agents to handle more clients each day... significantly saving on staffing costs” VP, Business AnalysisTop 10 Bank""The ability to meet users where they are and see what they see has been beneficial not only to the end users but also the product and tech development teams”Senior AnalystFortune 100 Insurance Company""The easiest vendor I’ve ever worked with!”PresidentOrion Advisor Services""...able to pull multiple disparate systems into one. It’s improved our Net Promoter Score, it’s given our people confidence, and it’s been a great experience”Senior Manager, Insurance OperationsMAPFRE Insurance""Glia provides an immense level of support, both pre and post-sale!”How Orion Offers aBetter Client Experience — and You Can TooGlia & Orion15% increase in customer satisfactionREAD MORELeading Insurer Drives Contact Center EfficiencyReduces total service contacts by 18% saving millions in staffing costsREAD MORETop US Bank Increases Online Loan Applications with GliaWithin 9 months launch, they achieved a 250% ROIREAD MORESee The VideoSee The Video  Your browser doesn't support HTML5 video tag.  Reinvent How You Serve CustomersWatch a Video, Explore Our Site, Book a Demo... Start ReinventingReinventing Customer ServiceHomeCompanyBlogPartnersCareersDEIResourcesDCS Summit PlatformsChannelLessCoBrowsingAI ManagementVideo ChatChatSMSServicesCustomer SuccessSecurityGlia SecurityBounty ProgramSolutionsIncrease SalesModernize SupportCustomer ExperienceDigital-CentricPhone-CentricHome AgentsVideo Banking© Glia Technologies, Inc. All rights reserved.Privacy Policy   I  Terms of Service   I  Security  I  Accessibility    "
1,surance,"surance. Insurance Digital Customer Service | Glia   Join Glia for the premier customer interaction event - DCS Summit 2023Learn MoreSolutionsBy KPISalesDrive more sales onlineCustomer ExperienceIncrease customer loyaltyModernize SupportEase customer effortBy functionDigital CentricI support customers onlinePhone CentricI support customers via phoneHome AgentsCustomer Service from AnywhereVideo BankingPersonalized & expert service at a distancePlatformservices & SECURITYNew apps. New features. New ways to create. It's everythingChannelLessFocus on the full customer engagementCoBrowsingObserve and collaboratively guide visitors on-screenSMSMake SMS part of a seamless digital experienceAI ManagementManage customer chatbots and virtual agent assistantsVoiceEngage via traditional phone or seamless OnScreen VoiceAppletsUnified agent desktop for efficiency and satisfactionVideo ChatBuild trust with face-to-face conversations onlineChatSecure live and bot-assisted messaging with collaborationWorkforce ManagementRight reps, right channels at the right timeservices WhiteGlove Customer SuccessOnboarding and customer guidanceSECURITYSecuritySecurity at the coreIndustriesBankingBring the personalized in-branch experience onlineCredit UnionsEnhance the member experienceFinTechRevolutionize customer communicationInsuranceImprove customer acquisition and satisfactionLendingSupport lender activitiesSmall Business BankingGuided lending and customer serviceCompanyAbout GliaWho's behind Digital-First Customer Service?Glia's PhilosophyCCHaMP - Because excellence is a verbDigital Customer Service DefinedThe what and why of DCSAwardsWinning digital-first service technologyNewsNews from and about GliaBlogEducation, information, postulationPartnersPartner With GliaContact UsReach out to usWe're Hiring!Join the teamDiversity, Equity, and InclusionLearn about our DEI ProgramResourcesCase StudiesGlia Digital Customer Service solutions in actionGuidesInteractive guides and infographicsEbooks & White PapersLight reading to advance your DCS knowledgeResource LibraryBetter understand how to improve your cx through our collection of resourcesVideosAnimated explainers, client testimonials and on-demand webcastsWe're HiringRequest a DemoWe're Hiring!Request a DemoDigital Customer Service Software for Insurance CompaniesImprove online sales and the policyholder digital experienceSarahWould you like help filing your claim? I can guide you through the form.Sounds great!Started CoBrowsingEasily layer rich collaboration on any of your existing quoting, application, servicing or claims digital experiences. Engage policyholders, agents, and potential customers in any channel to provide an effortless, personalized experience.Benefits for Insurance CompaniesSell More OnlineReduce Servicing CostsImprove Agent Brand LoyaltyTestimonial VideoGlia Client Experience: Mercury InsuranceKevin Bailey, Director of Underwriting Research and Innovation at Mercury Insurance, shares how Glia helped improve their online experiences for underwriters and agents.Watch the VideoHow Insurance Companies use GliaAccelerate D2C Policy SalesIncrease lead conversions 3-4x by proactively engaging potential customers before they abandon your online form. Providing onscreen guidance through chat, video, voice, with the ability to CoBrowse, makes it easier for policyholders to buy online. Communicating at the point of sale also allows for upsell and cross-sell opportunities.Enhanced Policyholder Support Assist your policyholders when, where and how they want it. Leverage Live Observation and CoBrowsing to gain valuable context and seamlessly guide policyholders to make policy changes, pay their bill or file a claim. Create exceptional service experiences to boost customer satisfaction scores and improve retention rates.Offer Premium Insurance Agent ExperiencesStreamline the experience on your agent portal by providing responsive, personalized on-screen service. Reduce confusion with real-time collaboration capabilities and build agent confidence and proficiency for future interactions. In doing so, you’ll foster agent satisfaction and boost your brand loyalty.Dynamic FNOLDrive claims processing success while improving customer satisfaction when policyholders need you most. Guide policyholders through your online First Notice of Loss (FNOL) form with CoBrowsing, ensuring accuracy and completeness that drives claims success. Adding OnScreen Voice or video to chat engagements during claims interactions enables reps to show empathy and improves customer satisfaction.Other Digital Customer Service (DCS) Use Cases for InsurersWe’ve highlighted some of the most common ways insurance companies are leveraging Glia’s DCS platform to improve their business, but there are many other applications in use today. Let us know the challenges you’re dealing with and we would be happy to discuss how Glia can be leveraged to solve your business challenge.Contact UsCLIENT SUCCESS STORYLeading P&C Insurer Drives Measured Contact Center Efficiency with GliaReduces total service contacts by 18%DownloadReinvent How You Serve Your Policyholders and AgentsRequest a Demo“With Glia we increased our online conversion by 4X""Leading Insurance CompanyReinventing Customer ServiceHomeCompanyBlogPartnersCareersDEIResourcesDCS Summit PlatformsChannelLessCoBrowsingAI ManagementVideo ChatChatSMSServicesCustomer SuccessSecurityGlia SecurityBounty ProgramSolutionsIncrease SalesModernize SupportCustomer ExperienceDigital-CentricPhone-CentricHome AgentsVideo Banking© Glia Technologies, Inc. All rights reserved.Privacy Policy   I  Terms of Service   I  Security  I  Accessibility  "
2,sources,"sources. Resources | Glia  Join Glia for the premier customer interaction event - DCS Summit 2023Learn MoreSolutionsBy KPISalesDrive more sales onlineCustomer ExperienceIncrease customer loyaltyModernize SupportEase customer effortBy functionDigital CentricI support customers onlinePhone CentricI support customers via phoneHome AgentsCustomer Service from AnywhereVideo BankingPersonalized & expert service at a distancePlatformservices & SECURITYNew apps. New features. New ways to create. It's everythingChannelLessFocus on the full customer engagementCoBrowsingObserve and collaboratively guide visitors on-screenSMSMake SMS part of a seamless digital experienceAI ManagementManage customer chatbots and virtual agent assistantsVoiceEngage via traditional phone or seamless OnScreen VoiceAppletsUnified agent desktop for efficiency and satisfactionVideo ChatBuild trust with face-to-face conversations onlineChatSecure live and bot-assisted messaging with collaborationWorkforce ManagementRight reps, right channels at the right timeservices WhiteGlove Customer SuccessOnboarding and customer guidanceSECURITYSecuritySecurity at the coreIndustriesBankingBring the personalized in-branch experience onlineCredit UnionsEnhance the member experienceFinTechRevolutionize customer communicationInsuranceImprove customer acquisition and satisfactionLendingSupport lender activitiesSmall Business BankingGuided lending and customer serviceCompanyAbout GliaWho's behind Digital-First Customer Service?Glia's PhilosophyCCHaMP - Because excellence is a verbDigital Customer Service DefinedThe what and why of DCSAwardsWinning digital-first service technologyNewsNews from and about GliaBlogEducation, information, postulationPartnersPartner With GliaContact UsReach out to usWe're Hiring!Join the teamDiversity, Equity, and InclusionLearn about our DEI ProgramResourcesCase StudiesGlia Digital Customer Service solutions in actionGuidesInteractive guides and infographicsEbooks & White PapersLight reading to advance your DCS knowledgeResource LibraryBetter understand how to improve your cx through our collection of resourcesVideosAnimated explainers, client testimonials and on-demand webcastsWe're HiringRequest a DemoWe're Hiring!Request a DemoResource LibraryBetter understand how to improve your customer experience through our collection of resourcesFeaturedGuided Small Business Lending in Times of NeedOvercome challenges of supporting small business borrowers and keep the customer relationship strongdownload NowCase StudiesEbooks & White papersVIDEOSguidesCase StudiesnewListerhill Credit Union Boosts Mortgage Sales with Digital-First ServicePuts members first with Digital Customer ServicenewLeading Insurer Delivers Seamless Experiences Across 7 Business UnitsFortune 100 Insurer has rolled out Glia’s Digital Customer Service (DCS).newGulf Coast Educators FCU Expands Across Texas with DCSDigital-First Solutions Improve Both Online and In-Branch Member Experiences.VIEW ALL CASE STUDIES >White PapersnewIVAs: One Piece of a Bigger Contact Center PuzzleIVAs are a useful tool in your company’s utility belt, but they’re not a silver bullet. newBring Your Phone Experience to the Modern AgeDiscover 6 signs its time to modernize your call centernewRetaining Customers Through Technology Upgrades & ConversionsHaving the right DCS tools in place to assist before changes happen will smooth out friction pointsVIEW ALL WHITE PAPERS >VideosDigital Customer Service for BanksGlia Call CenterSureify Summit 2022 - How Carriers are Differentiating with Digital Customer ServiceVIEW ALL VIDEOS >Ebooksnew5 Key Drivers in the Adoption of Virtual Banking AssistantsSee how effective self-service options benefit consumers and financial institutions alike.newDCS Differentiates Financial Institutions During a Time of Intense CompetitionBanking Dive digs into how banks & credit unions can differentiate themselves in fluctuating marketsnewGuide to Banking ChatbotsWe outline key considerations for selecting virtual assistants for your bank or credit union.VIEW ALL EBOOKS >GuidesnewDrive Digital Adoption Throughout Banking Technology ChangesAvoid Common Pitfalls & Support Digital UsersnewCustomer Service Across Generations - From Boomers to ZoomersHow to Meet the Customer Service Needs of Each Every Generation.newBy the Numbers: Defining Success in Digital Customer ServiceGlia has earned industry awards, analyst mentions, published a category-defining book and more.VIEW ALL GUIDES >Webinar VideosA Perfect Match: Digital Customer Service and the Call CenterHow Uncertainty in the Economy Impacts Credit UnionsGlia Virtual Assistants: Demo and Q&AVIEW ALL VIDEOS >Reinventing Customer ServiceHomeCompanyBlogPartnersCareersDEIResourcesDCS Summit PlatformsChannelLessCoBrowsingAI ManagementVideo ChatChatSMSServicesCustomer SuccessSecurityGlia SecurityBounty ProgramSolutionsIncrease SalesModernize SupportCustomer ExperienceDigital-CentricPhone-CentricHome AgentsVideo Banking© Glia Technologies, Inc. All rights reserved.Privacy Policy   I  Terms of Service   I  Security  I  Accessibility  "
3,deo glia virtual assistants demo and q a,"deo glia virtual assistants demo and q a. Glia Virtual Assistants: Demo and Q&A  Join Glia for the premier customer interaction event - DCS Summit 2023Learn MoreSolutionsBy KPISalesDrive more sales onlineCustomer ExperienceIncrease customer loyaltyModernize SupportEase customer effortBy functionDigital CentricI support customers onlinePhone CentricI support customers via phoneHome AgentsCustomer Service from AnywhereVideo BankingPersonalized & expert service at a distancePlatformservices & SECURITYNew apps. New features. New ways to create. It's everythingChannelLessFocus on the full customer engagementCoBrowsingObserve and collaboratively guide visitors on-screenSMSMake SMS part of a seamless digital experienceAI ManagementManage customer chatbots and virtual agent assistantsVoiceEngage via traditional phone or seamless OnScreen VoiceAppletsUnified agent desktop for efficiency and satisfactionVideo ChatBuild trust with face-to-face conversations onlineChatSecure live and bot-assisted messaging with collaborationWorkforce ManagementRight reps, right channels at the right timeservices WhiteGlove Customer SuccessOnboarding and customer guidanceSECURITYSecuritySecurity at the coreIndustriesBankingBring the personalized in-branch experience onlineCredit UnionsEnhance the member experienceFinTechRevolutionize customer communicationInsuranceImprove customer acquisition and satisfactionLendingSupport lender activitiesSmall Business BankingGuided lending and customer serviceCompanyAbout GliaWho's behind Digital-First Customer Service?Glia's PhilosophyCCHaMP - Because excellence is a verbDigital Customer Service DefinedThe what and why of DCSAwardsWinning digital-first service technologyNewsNews from and about GliaBlogEducation, information, postulationPartnersPartner With GliaContact UsReach out to usWe're Hiring!Join the teamDiversity, Equity, and InclusionLearn about our DEI ProgramResourcesCase StudiesGlia Digital Customer Service solutions in actionGuidesInteractive guides and infographicsEbooks & White PapersLight reading to advance your DCS knowledgeResource LibraryBetter understand how to improve your cx through our collection of resourcesVideosAnimated explainers, client testimonials and on-demand webcastsWe're HiringRequest a DemoWe're Hiring!Request a Demowebinar19:30Glia Virtual Assistants: Demo and Q&A webinar19:30Glia Virtual Assistants: Demo and Q&AHave you wondered how adding AI-powered chatbots to your Digital Customer Service solution would impact your business' efficiency? Watch outtakes of our webinar to understand how implementing virtual assistants has:Shortened average wait timeIncreased contact center efficienciesGiven customers/members the digital convenience they want and expectGlia Virtual Assistants (GVAs) are pre-built AI assistants that automate routine service inquiries to help customers/members self-serve and navigate your public and authenticated digital properties. They are fueled by 800+ banking user goals and a content management system to easily customize responses.GVAs can pass engagements to live agents with full context as part of a Digital Customer Service platform (including voice, video, and OnScreen collaboration), and are easily managed through the AI Management module.GliaWhat Jim is Reading and Listening To Right NowUltimate Guide to CoBrowsingJim’s Favorite New Product Outside of WorkAmazon EchoLatest VideosA Perfect Match: Digital Customer Service and the Call CenterDigital Customer Service for BanksGlia Call CenterReinventing Customer ServiceHomeCompanyBlogPartnersCareersDEIResourcesDCS Summit PlatformsChannelLessCoBrowsingAI ManagementVideo ChatChatSMSServicesCustomer SuccessSecurityGlia SecurityBounty ProgramSolutionsIncrease SalesModernize SupportCustomer ExperienceDigital-CentricPhone-CentricHome AgentsVideo Banking© Glia Technologies, Inc. All rights reserved.Privacy Policy   I  Terms of Service   I  Security  I  Accessibility  "
4,deo digital customer service for banks,"deo digital customer service for banks. Digital Customer Service for Banks  Join Glia for the premier customer interaction event - DCS Summit 2023Learn MoreSolutionsBy KPISalesDrive more sales onlineCustomer ExperienceIncrease customer loyaltyModernize SupportEase customer effortBy functionDigital CentricI support customers onlinePhone CentricI support customers via phoneHome AgentsCustomer Service from AnywhereVideo BankingPersonalized & expert service at a distancePlatformservices & SECURITYNew apps. New features. New ways to create. It's everythingChannelLessFocus on the full customer engagementCoBrowsingObserve and collaboratively guide visitors on-screenSMSMake SMS part of a seamless digital experienceAI ManagementManage customer chatbots and virtual agent assistantsVoiceEngage via traditional phone or seamless OnScreen VoiceAppletsUnified agent desktop for efficiency and satisfactionVideo ChatBuild trust with face-to-face conversations onlineChatSecure live and bot-assisted messaging with collaborationWorkforce ManagementRight reps, right channels at the right timeservices WhiteGlove Customer SuccessOnboarding and customer guidanceSECURITYSecuritySecurity at the coreIndustriesBankingBring the personalized in-branch experience onlineCredit UnionsEnhance the member experienceFinTechRevolutionize customer communicationInsuranceImprove customer acquisition and satisfactionLendingSupport lender activitiesSmall Business BankingGuided lending and customer serviceCompanyAbout GliaWho's behind Digital-First Customer Service?Glia's PhilosophyCCHaMP - Because excellence is a verbDigital Customer Service DefinedThe what and why of DCSAwardsWinning digital-first service technologyNewsNews from and about GliaBlogEducation, information, postulationPartnersPartner With GliaContact UsReach out to usWe're Hiring!Join the teamDiversity, Equity, and InclusionLearn about our DEI ProgramResourcesCase StudiesGlia Digital Customer Service solutions in actionGuidesInteractive guides and infographicsEbooks & White PapersLight reading to advance your DCS knowledgeResource LibraryBetter understand how to improve your cx through our collection of resourcesVideosAnimated explainers, client testimonials and on-demand webcastsWe're HiringRequest a DemoWe're Hiring!Request a Demosolution1:12Digital Customer Service for Banks solution1:12Digital Customer Service for BanksWith customer expectations continuously increasing, banks need to deliver efficient Digital Customer Service with seamless transitions between channels. Using only one line of code, Glia’s Digital Customer Service (DCS) solution is easily integrated into a bank’s tech stack for engagements in any channel, including chat and video. DCS collaboration tools, such as CoBrowsing, help guide bank customers and enrich the digital customer experience.  When banks integrate CRM programs, these engagements are further personalized to increase conversions and boost satisfaction. Watch the video to learn more about elevating DCS for banks. GliaWhat Jim is Reading and Listening To Right NowUltimate Guide to CoBrowsingJim’s Favorite New Product Outside of WorkAmazon EchoLatest VideosA Perfect Match: Digital Customer Service and the Call CenterDigital Customer Service for BanksGlia Call CenterReinventing Customer ServiceHomeCompanyBlogPartnersCareersDEIResourcesDCS Summit PlatformsChannelLessCoBrowsingAI ManagementVideo ChatChatSMSServicesCustomer SuccessSecurityGlia SecurityBounty ProgramSolutionsIncrease SalesModernize SupportCustomer ExperienceDigital-CentricPhone-CentricHome AgentsVideo Banking© Glia Technologies, Inc. All rights reserved.Privacy Policy   I  Terms of Service   I  Security  I  Accessibility  "
