,fname,text
107,ws simple brand 88 podcast rick delisi digital customer service,"ws simple brand 88 podcast rick delisi digital customer service. [SIMPLE brand] #88 Podcast - Rick DeLisi: Digital Customer Service   Join Glia for the premier customer interaction event - DCS Summit 2023Learn MoreSolutionsBy KPISalesDrive more sales onlineCustomer ExperienceIncrease customer loyaltyModernize SupportEase customer effortBy functionDigital CentricI support customers onlinePhone CentricI support customers via phoneHome AgentsCustomer Service from AnywhereVideo BankingPersonalized & expert service at a distancePlatformservices & SECURITYNew apps. New features. New ways to create. It's everythingChannelLessFocus on the full customer engagementCoBrowsingObserve and collaboratively guide visitors on-screenSMSMake SMS part of a seamless digital experienceAI ManagementManage customer chatbots and virtual agent assistantsVoiceEngage via traditional phone or seamless OnScreen VoiceAppletsUnified agent desktop for efficiency and satisfactionVideo ChatBuild trust with face-to-face conversations onlineChatSecure live and bot-assisted messaging with collaborationWorkforce ManagementRight reps, right channels at the right timeservices WhiteGlove Customer SuccessOnboarding and customer guidanceSECURITYSecuritySecurity at the coreIndustriesBankingBring the personalized in-branch experience onlineCredit UnionsEnhance the member experienceFinTechRevolutionize customer communicationInsuranceImprove customer acquisition and satisfactionLendingSupport lender activitiesSmall Business BankingGuided lending and customer serviceCompanyAbout GliaWho's behind Digital-First Customer Service?Glia's PhilosophyCCHaMP - Because excellence is a verbDigital Customer Service DefinedThe what and why of DCSAwardsWinning digital-first service technologyNewsNews from and about GliaBlogEducation, information, postulationPartnersPartner With GliaContact UsReach out to usWe're Hiring!Join the teamDiversity, Equity, and InclusionLearn about our DEI ProgramResourcesCase StudiesGlia Digital Customer Service solutions in actionGuidesInteractive guides and infographicsEbooks & White PapersLight reading to advance your DCS knowledgeResource LibraryBetter understand how to improve your cx through our collection of resourcesVideosAnimated explainers, client testimonials and on-demand webcastsWe're HiringRequest a DemoWe're Hiring!Request a Demo[SIMPLE brand] #88 Podcast - Rick DeLisi: Digital Customer ServiceOctober 19, 2022Latest News[Credit Union Times] What CUs Can Learn From Frontier Airlines’ New Customer Interaction Strategy[Credit Union Times] What CUs Can Learn From Frontier Airlines’ New Customer Interaction Strategy[Bank Automation News] Listerhill Credit Union Raises Call Deflection Rate to 67% Through Glia[Bank Automation News] Listerhill Credit Union Raises Call Deflection Rate to 67% Through Glia[Bank Business News] The Customer Experience is the Key to Surviving (and Thriving) in Challenging Economic Times[Bank Business News] The Customer Experience is the Key to Surviving (and Thriving) in Challenging Economic TimesVIEW ALL NEWS>Reinventing Customer ServiceHomeCompanyBlogPartnersCareersDEIResourcesDCS Summit PlatformsChannelLessCoBrowsingAI ManagementVideo ChatChatSMSServicesCustomer SuccessSecurityGlia SecurityBounty ProgramSolutionsIncrease SalesModernize SupportCustomer ExperienceDigital-CentricPhone-CentricHome AgentsVideo Banking© Glia Technologies, Inc. All rights reserved.Privacy Policy   I  Terms of Service   I  Security  I  Accessibility  "
108,ws holiday it wish list for 2023,"ws holiday it wish list for 2023. [Finopotamus] Holiday IT Wish List for 2023   Join Glia for the premier customer interaction event - DCS Summit 2023Learn MoreSolutionsBy KPISalesDrive more sales onlineCustomer ExperienceIncrease customer loyaltyModernize SupportEase customer effortBy functionDigital CentricI support customers onlinePhone CentricI support customers via phoneHome AgentsCustomer Service from AnywhereVideo BankingPersonalized & expert service at a distancePlatformservices & SECURITYNew apps. New features. New ways to create. It's everythingChannelLessFocus on the full customer engagementCoBrowsingObserve and collaboratively guide visitors on-screenSMSMake SMS part of a seamless digital experienceAI ManagementManage customer chatbots and virtual agent assistantsVoiceEngage via traditional phone or seamless OnScreen VoiceAppletsUnified agent desktop for efficiency and satisfactionVideo ChatBuild trust with face-to-face conversations onlineChatSecure live and bot-assisted messaging with collaborationWorkforce ManagementRight reps, right channels at the right timeservices WhiteGlove Customer SuccessOnboarding and customer guidanceSECURITYSecuritySecurity at the coreIndustriesBankingBring the personalized in-branch experience onlineCredit UnionsEnhance the member experienceFinTechRevolutionize customer communicationInsuranceImprove customer acquisition and satisfactionLendingSupport lender activitiesSmall Business BankingGuided lending and customer serviceCompanyAbout GliaWho's behind Digital-First Customer Service?Glia's PhilosophyCCHaMP - Because excellence is a verbDigital Customer Service DefinedThe what and why of DCSAwardsWinning digital-first service technologyNewsNews from and about GliaBlogEducation, information, postulationPartnersPartner With GliaContact UsReach out to usWe're Hiring!Join the teamDiversity, Equity, and InclusionLearn about our DEI ProgramResourcesCase StudiesGlia Digital Customer Service solutions in actionGuidesInteractive guides and infographicsEbooks & White PapersLight reading to advance your DCS knowledgeResource LibraryBetter understand how to improve your cx through our collection of resourcesVideosAnimated explainers, client testimonials and on-demand webcastsWe're HiringRequest a DemoWe're Hiring!Request a Demo[Finopotamus] Holiday IT Wish List for 2023December 20, 2022Latest News[Credit Union Times] What CUs Can Learn From Frontier Airlines’ New Customer Interaction Strategy[Credit Union Times] What CUs Can Learn From Frontier Airlines’ New Customer Interaction Strategy[Bank Automation News] Listerhill Credit Union Raises Call Deflection Rate to 67% Through Glia[Bank Automation News] Listerhill Credit Union Raises Call Deflection Rate to 67% Through Glia[Bank Business News] The Customer Experience is the Key to Surviving (and Thriving) in Challenging Economic Times[Bank Business News] The Customer Experience is the Key to Surviving (and Thriving) in Challenging Economic TimesVIEW ALL NEWS>Reinventing Customer ServiceHomeCompanyBlogPartnersCareersDEIResourcesDCS Summit PlatformsChannelLessCoBrowsingAI ManagementVideo ChatChatSMSServicesCustomer SuccessSecurityGlia SecurityBounty ProgramSolutionsIncrease SalesModernize SupportCustomer ExperienceDigital-CentricPhone-CentricHome AgentsVideo Banking© Glia Technologies, Inc. All rights reserved.Privacy Policy   I  Terms of Service   I  Security  I  Accessibility  "
109,ws glia and finastra to accelerate transition from phone first to digital first customer service,"ws glia and finastra to accelerate transition from phone first to digital first customer service. Glia and Finastra to Accelerate Transition from Phone-First to Digital-First Customer Service for Financial Institutions   Join Glia for the premier customer interaction event - DCS Summit 2023Learn MoreSolutionsBy KPISalesDrive more sales onlineCustomer ExperienceIncrease customer loyaltyModernize SupportEase customer effortBy functionDigital CentricI support customers onlinePhone CentricI support customers via phoneHome AgentsCustomer Service from AnywhereVideo BankingPersonalized & expert service at a distancePlatformservices & SECURITYNew apps. New features. New ways to create. It's everythingChannelLessFocus on the full customer engagementCoBrowsingObserve and collaboratively guide visitors on-screenSMSMake SMS part of a seamless digital experienceAI ManagementManage customer chatbots and virtual agent assistantsVoiceEngage via traditional phone or seamless OnScreen VoiceAppletsUnified agent desktop for efficiency and satisfactionVideo ChatBuild trust with face-to-face conversations onlineChatSecure live and bot-assisted messaging with collaborationWorkforce ManagementRight reps, right channels at the right timeservices WhiteGlove Customer SuccessOnboarding and customer guidanceSECURITYSecuritySecurity at the coreIndustriesBankingBring the personalized in-branch experience onlineCredit UnionsEnhance the member experienceFinTechRevolutionize customer communicationInsuranceImprove customer acquisition and satisfactionLendingSupport lender activitiesSmall Business BankingGuided lending and customer serviceCompanyAbout GliaWho's behind Digital-First Customer Service?Glia's PhilosophyCCHaMP - Because excellence is a verbDigital Customer Service DefinedThe what and why of DCSAwardsWinning digital-first service technologyNewsNews from and about GliaBlogEducation, information, postulationPartnersPartner With GliaContact UsReach out to usWe're Hiring!Join the teamDiversity, Equity, and InclusionLearn about our DEI ProgramResourcesCase StudiesGlia Digital Customer Service solutions in actionGuidesInteractive guides and infographicsEbooks & White PapersLight reading to advance your DCS knowledgeResource LibraryBetter understand how to improve your cx through our collection of resourcesVideosAnimated explainers, client testimonials and on-demand webcastsWe're HiringRequest a DemoWe're Hiring!Request a DemoGlia and Finastra to Accelerate Transition from Phone-First to Digital-First Customer Service for Financial InstitutionsOctober 31, 2022New app streamlines front-end digital transformation, improving customer experience through FusionFabric.cloud‍NEW YORK—October 31, 2022 - Glia, the leading provider of Digital Customer Service (DCS), has teamed up with Finastra, a global provider of financial software applications and marketplaces, to help financial institutions to improve the digital customer experience. Via its FusionFabric.cloud platform and Fusion Digital Banking solution, Finastra will offer Glia’s Digital Customer Service (DCS) capabilities as a new app.“The powerful combination of Glia’s Digital Customer Service (DCS) platform and seamless integration capabilities will help empower our network of community institutions to make the move from a phone-first to digital-first customer service strategy,” said Narendra Mistry, Chief Product Officer, Universal Banking at Finastra. “In making this app available on our platform, financial institutions can tap into these innovative capabilities to improve customer experience and accelerate digital banking, with the benefit of building deeper customer relationships, reducing call times and increasing efficiencies.” With Glia, financial institutions can meet customers where they are and communicate through whichever method they prefer—including messaging, video banking and voice—and guide them using CoBrowsing. Glia’s technology balances the use of AI for automating customer interactions with vital human touch. It provides continuity by keeping conversations in the digital domain, eliminating the need for customers to spend time providing context again via clunky phone experiences. ""Finastra has a strong reputation and impressive traction in financial services, helping community institutions evolve as technology and customer expectations quickly evolve,"" said Steve Kaish, SVP of alliances for Glia. ""Together, we're helping Finastra’s clients more easily adopt Digital Customer Service so they can consistently deliver five-star experiences. We’re proud to partner with an industry leader like Finastra, providing the tools needed for its network of banks and credit unions to digitalize and enhance customer service.”About GliaGlia is reinventing how businesses support their customers in a digital world. Glia's Digital Customer Service (DCS) solution enriches web and mobile experiences with digital communication choices, on-screen collaboration, and AI-enabled assistance. Glia has partnered with over 300 banks, credit unions, insurance companies and other financial institutions worldwide to improve the customer experience and drive business results. Named both a Deloitte Technology Fast 500™ company and a Great Place to Work (with a 97% employee satisfaction rating) for a second year in a row, Glia continues to achieve broad industry recognition and customer service thought leadership including publishing the definitive book on DCS with Wiley. The company has raised over $150 million in funding from top investors. To learn more, visit glia.com.About FinastraFinastra is a global provider of financial software applications and marketplaces, and launched the leading open platform for innovation, FusionFabric.cloud, in 2017. It serves institutions of all sizes, providing award-winning solutions and services across Lending, Payments, Treasury & Capital Markets and Universal Banking (retail, digital and corporate banking) for banks to support direct banking relationships and grow through indirect channels, such as embedded finance and Banking as a Service. Its pioneering approach and commitment to open finance and collaboration is why it is trusted by ~8,600 institutions, including 90 of the world’s top 100 banks. For more information, visit finastra.com.Latest News[Credit Union Times] What CUs Can Learn From Frontier Airlines’ New Customer Interaction Strategy[Credit Union Times] What CUs Can Learn From Frontier Airlines’ New Customer Interaction Strategy[Bank Automation News] Listerhill Credit Union Raises Call Deflection Rate to 67% Through Glia[Bank Automation News] Listerhill Credit Union Raises Call Deflection Rate to 67% Through Glia[Bank Business News] The Customer Experience is the Key to Surviving (and Thriving) in Challenging Economic Times[Bank Business News] The Customer Experience is the Key to Surviving (and Thriving) in Challenging Economic TimesVIEW ALL NEWS>Reinventing Customer ServiceHomeCompanyBlogPartnersCareersDEIResourcesDCS Summit PlatformsChannelLessCoBrowsingAI ManagementVideo ChatChatSMSServicesCustomer SuccessSecurityGlia SecurityBounty ProgramSolutionsIncrease SalesModernize SupportCustomer ExperienceDigital-CentricPhone-CentricHome AgentsVideo Banking© Glia Technologies, Inc. All rights reserved.Privacy Policy   I  Terms of Service   I  Security  I  Accessibility  "
110,ws cu today listerhill credit union selects digital customer solution from glia to streamline online services,"ws cu today listerhill credit union selects digital customer solution from glia to streamline online services. [CU Today] Listerhill Credit Union Selects Digital Customer Solution from Glia to ‘Streamline’ Online Services   Join Glia for the premier customer interaction event - DCS Summit 2023Learn MoreSolutionsBy KPISalesDrive more sales onlineCustomer ExperienceIncrease customer loyaltyModernize SupportEase customer effortBy functionDigital CentricI support customers onlinePhone CentricI support customers via phoneHome AgentsCustomer Service from AnywhereVideo BankingPersonalized & expert service at a distancePlatformservices & SECURITYNew apps. New features. New ways to create. It's everythingChannelLessFocus on the full customer engagementCoBrowsingObserve and collaboratively guide visitors on-screenSMSMake SMS part of a seamless digital experienceAI ManagementManage customer chatbots and virtual agent assistantsVoiceEngage via traditional phone or seamless OnScreen VoiceAppletsUnified agent desktop for efficiency and satisfactionVideo ChatBuild trust with face-to-face conversations onlineChatSecure live and bot-assisted messaging with collaborationWorkforce ManagementRight reps, right channels at the right timeservices WhiteGlove Customer SuccessOnboarding and customer guidanceSECURITYSecuritySecurity at the coreIndustriesBankingBring the personalized in-branch experience onlineCredit UnionsEnhance the member experienceFinTechRevolutionize customer communicationInsuranceImprove customer acquisition and satisfactionLendingSupport lender activitiesSmall Business BankingGuided lending and customer serviceCompanyAbout GliaWho's behind Digital-First Customer Service?Glia's PhilosophyCCHaMP - Because excellence is a verbDigital Customer Service DefinedThe what and why of DCSAwardsWinning digital-first service technologyNewsNews from and about GliaBlogEducation, information, postulationPartnersPartner With GliaContact UsReach out to usWe're Hiring!Join the teamDiversity, Equity, and InclusionLearn about our DEI ProgramResourcesCase StudiesGlia Digital Customer Service solutions in actionGuidesInteractive guides and infographicsEbooks & White PapersLight reading to advance your DCS knowledgeResource LibraryBetter understand how to improve your cx through our collection of resourcesVideosAnimated explainers, client testimonials and on-demand webcastsWe're HiringRequest a DemoWe're Hiring!Request a Demo[CU Today] Listerhill Credit Union Selects Digital Customer Solution from Glia to ‘Streamline’ Online ServicesFebruary 6, 2023Latest News[Credit Union Times] What CUs Can Learn From Frontier Airlines’ New Customer Interaction Strategy[Credit Union Times] What CUs Can Learn From Frontier Airlines’ New Customer Interaction Strategy[Bank Automation News] Listerhill Credit Union Raises Call Deflection Rate to 67% Through Glia[Bank Automation News] Listerhill Credit Union Raises Call Deflection Rate to 67% Through Glia[Bank Business News] The Customer Experience is the Key to Surviving (and Thriving) in Challenging Economic Times[Bank Business News] The Customer Experience is the Key to Surviving (and Thriving) in Challenging Economic TimesVIEW ALL NEWS>Reinventing Customer ServiceHomeCompanyBlogPartnersCareersDEIResourcesDCS Summit PlatformsChannelLessCoBrowsingAI ManagementVideo ChatChatSMSServicesCustomer SuccessSecurityGlia SecurityBounty ProgramSolutionsIncrease SalesModernize SupportCustomer ExperienceDigital-CentricPhone-CentricHome AgentsVideo Banking© Glia Technologies, Inc. All rights reserved.Privacy Policy   I  Terms of Service   I  Security  I  Accessibility  "
111,ws playvox live human conversations in the digital age how do call centers navigate this mismatch,"ws playvox live human conversations in the digital age how do call centers navigate this mismatch. [Playvox] Live Human Conversations in the Digital Age: How do Call Centers Navigate This Mismatch   Join Glia for the premier customer interaction event - DCS Summit 2023Learn MoreSolutionsBy KPISalesDrive more sales onlineCustomer ExperienceIncrease customer loyaltyModernize SupportEase customer effortBy functionDigital CentricI support customers onlinePhone CentricI support customers via phoneHome AgentsCustomer Service from AnywhereVideo BankingPersonalized & expert service at a distancePlatformservices & SECURITYNew apps. New features. New ways to create. It's everythingChannelLessFocus on the full customer engagementCoBrowsingObserve and collaboratively guide visitors on-screenSMSMake SMS part of a seamless digital experienceAI ManagementManage customer chatbots and virtual agent assistantsVoiceEngage via traditional phone or seamless OnScreen VoiceAppletsUnified agent desktop for efficiency and satisfactionVideo ChatBuild trust with face-to-face conversations onlineChatSecure live and bot-assisted messaging with collaborationWorkforce ManagementRight reps, right channels at the right timeservices WhiteGlove Customer SuccessOnboarding and customer guidanceSECURITYSecuritySecurity at the coreIndustriesBankingBring the personalized in-branch experience onlineCredit UnionsEnhance the member experienceFinTechRevolutionize customer communicationInsuranceImprove customer acquisition and satisfactionLendingSupport lender activitiesSmall Business BankingGuided lending and customer serviceCompanyAbout GliaWho's behind Digital-First Customer Service?Glia's PhilosophyCCHaMP - Because excellence is a verbDigital Customer Service DefinedThe what and why of DCSAwardsWinning digital-first service technologyNewsNews from and about GliaBlogEducation, information, postulationPartnersPartner With GliaContact UsReach out to usWe're Hiring!Join the teamDiversity, Equity, and InclusionLearn about our DEI ProgramResourcesCase StudiesGlia Digital Customer Service solutions in actionGuidesInteractive guides and infographicsEbooks & White PapersLight reading to advance your DCS knowledgeResource LibraryBetter understand how to improve your cx through our collection of resourcesVideosAnimated explainers, client testimonials and on-demand webcastsWe're HiringRequest a DemoWe're Hiring!Request a Demo[Playvox] Live Human Conversations in the Digital Age: How do Call Centers Navigate This MismatchAugust 22, 2022Latest News[Credit Union Times] What CUs Can Learn From Frontier Airlines’ New Customer Interaction Strategy[Credit Union Times] What CUs Can Learn From Frontier Airlines’ New Customer Interaction Strategy[Bank Automation News] Listerhill Credit Union Raises Call Deflection Rate to 67% Through Glia[Bank Automation News] Listerhill Credit Union Raises Call Deflection Rate to 67% Through Glia[Bank Business News] The Customer Experience is the Key to Surviving (and Thriving) in Challenging Economic Times[Bank Business News] The Customer Experience is the Key to Surviving (and Thriving) in Challenging Economic TimesVIEW ALL NEWS>Reinventing Customer ServiceHomeCompanyBlogPartnersCareersDEIResourcesDCS Summit PlatformsChannelLessCoBrowsingAI ManagementVideo ChatChatSMSServicesCustomer SuccessSecurityGlia SecurityBounty ProgramSolutionsIncrease SalesModernize SupportCustomer ExperienceDigital-CentricPhone-CentricHome AgentsVideo Banking© Glia Technologies, Inc. All rights reserved.Privacy Policy   I  Terms of Service   I  Security  I  Accessibility  "
112,ws financial brand bank call centers are broken heres what needs to be fixed,"ws financial brand bank call centers are broken heres what needs to be fixed. [Financial Brand] Bank Call Centers are Broken: Here's What Needs to be Fixed   Join Glia for the premier customer interaction event - DCS Summit 2023Learn MoreSolutionsBy KPISalesDrive more sales onlineCustomer ExperienceIncrease customer loyaltyModernize SupportEase customer effortBy functionDigital CentricI support customers onlinePhone CentricI support customers via phoneHome AgentsCustomer Service from AnywhereVideo BankingPersonalized & expert service at a distancePlatformservices & SECURITYNew apps. New features. New ways to create. It's everythingChannelLessFocus on the full customer engagementCoBrowsingObserve and collaboratively guide visitors on-screenSMSMake SMS part of a seamless digital experienceAI ManagementManage customer chatbots and virtual agent assistantsVoiceEngage via traditional phone or seamless OnScreen VoiceAppletsUnified agent desktop for efficiency and satisfactionVideo ChatBuild trust with face-to-face conversations onlineChatSecure live and bot-assisted messaging with collaborationWorkforce ManagementRight reps, right channels at the right timeservices WhiteGlove Customer SuccessOnboarding and customer guidanceSECURITYSecuritySecurity at the coreIndustriesBankingBring the personalized in-branch experience onlineCredit UnionsEnhance the member experienceFinTechRevolutionize customer communicationInsuranceImprove customer acquisition and satisfactionLendingSupport lender activitiesSmall Business BankingGuided lending and customer serviceCompanyAbout GliaWho's behind Digital-First Customer Service?Glia's PhilosophyCCHaMP - Because excellence is a verbDigital Customer Service DefinedThe what and why of DCSAwardsWinning digital-first service technologyNewsNews from and about GliaBlogEducation, information, postulationPartnersPartner With GliaContact UsReach out to usWe're Hiring!Join the teamDiversity, Equity, and InclusionLearn about our DEI ProgramResourcesCase StudiesGlia Digital Customer Service solutions in actionGuidesInteractive guides and infographicsEbooks & White PapersLight reading to advance your DCS knowledgeResource LibraryBetter understand how to improve your cx through our collection of resourcesVideosAnimated explainers, client testimonials and on-demand webcastsWe're HiringRequest a DemoWe're Hiring!Request a Demo[Financial Brand] Bank Call Centers are Broken: Here's What Needs to be FixedAugust 24, 2022Latest News[Credit Union Times] What CUs Can Learn From Frontier Airlines’ New Customer Interaction Strategy[Credit Union Times] What CUs Can Learn From Frontier Airlines’ New Customer Interaction Strategy[Bank Automation News] Listerhill Credit Union Raises Call Deflection Rate to 67% Through Glia[Bank Automation News] Listerhill Credit Union Raises Call Deflection Rate to 67% Through Glia[Bank Business News] The Customer Experience is the Key to Surviving (and Thriving) in Challenging Economic Times[Bank Business News] The Customer Experience is the Key to Surviving (and Thriving) in Challenging Economic TimesVIEW ALL NEWS>Reinventing Customer ServiceHomeCompanyBlogPartnersCareersDEIResourcesDCS Summit PlatformsChannelLessCoBrowsingAI ManagementVideo ChatChatSMSServicesCustomer SuccessSecurityGlia SecurityBounty ProgramSolutionsIncrease SalesModernize SupportCustomer ExperienceDigital-CentricPhone-CentricHome AgentsVideo Banking© Glia Technologies, Inc. All rights reserved.Privacy Policy   I  Terms of Service   I  Security  I  Accessibility  "
