,fname,text
33,deo turn outbound sms into 2 way conversations,"deo turn outbound sms into 2 way conversations. Turn Outbound SMS into 2-Way Conversations  Join Glia for the premier customer interaction event - DCS Summit 2023Learn MoreSolutionsBy KPISalesDrive more sales onlineCustomer ExperienceIncrease customer loyaltyModernize SupportEase customer effortBy functionDigital CentricI support customers onlinePhone CentricI support customers via phoneHome AgentsCustomer Service from AnywhereVideo BankingPersonalized & expert service at a distancePlatformservices & SECURITYNew apps. New features. New ways to create. It's everythingChannelLessFocus on the full customer engagementCoBrowsingObserve and collaboratively guide visitors on-screenSMSMake SMS part of a seamless digital experienceAI ManagementManage customer chatbots and virtual agent assistantsVoiceEngage via traditional phone or seamless OnScreen VoiceAppletsUnified agent desktop for efficiency and satisfactionVideo ChatBuild trust with face-to-face conversations onlineChatSecure live and bot-assisted messaging with collaborationWorkforce ManagementRight reps, right channels at the right timeservices WhiteGlove Customer SuccessOnboarding and customer guidanceSECURITYSecuritySecurity at the coreIndustriesBankingBring the personalized in-branch experience onlineCredit UnionsEnhance the member experienceFinTechRevolutionize customer communicationInsuranceImprove customer acquisition and satisfactionLendingSupport lender activitiesSmall Business BankingGuided lending and customer serviceCompanyAbout GliaWho's behind Digital-First Customer Service?Glia's PhilosophyCCHaMP - Because excellence is a verbDigital Customer Service DefinedThe what and why of DCSAwardsWinning digital-first service technologyNewsNews from and about GliaBlogEducation, information, postulationPartnersPartner With GliaContact UsReach out to usWe're Hiring!Join the teamDiversity, Equity, and InclusionLearn about our DEI ProgramResourcesCase StudiesGlia Digital Customer Service solutions in actionGuidesInteractive guides and infographicsEbooks & White PapersLight reading to advance your DCS knowledgeResource LibraryBetter understand how to improve your cx through our collection of resourcesVideosAnimated explainers, client testimonials and on-demand webcastsWe're HiringRequest a DemoWe're Hiring!Request a Demosolution2:47Turn Outbound SMS into 2-Way Conversations solution2:47Turn Outbound SMS into 2-Way ConversationsAre your text campaigns and proactive notifications monologues or dialogues with your customers? Glia’s SMS Gateway extends your one-way SMS notifications and messaging campaigns into two-way conversations, so you can send messages that clients can respond to and seamlessly interact with your team.Studies show that SMS messages are consumed faster and more often than other forms of communication. Clients can respond to text alerts when it’s most convenient for them and interact with a chatbot powered by Glia’s AI Management or with one of your operators to quickly process transactions, handle inquiries, or resolve issues.Watch the video to learn more about how Glia’s SMS Gateway can energize your customer communications.GliaWhat Jim is Reading and Listening To Right NowUltimate Guide to CoBrowsingJim’s Favorite New Product Outside of WorkAmazon EchoLatest VideosA Perfect Match: Digital Customer Service and the Call CenterDigital Customer Service for BanksGlia Call CenterReinventing Customer ServiceHomeCompanyBlogPartnersCareersDEIResourcesDCS Summit PlatformsChannelLessCoBrowsingAI ManagementVideo ChatChatSMSServicesCustomer SuccessSecurityGlia SecurityBounty ProgramSolutionsIncrease SalesModernize SupportCustomer ExperienceDigital-CentricPhone-CentricHome AgentsVideo Banking© Glia Technologies, Inc. All rights reserved.Privacy Policy   I  Terms of Service   I  Security  I  Accessibility  "
34, gateway," gateway. Glia SMS Gateway | Interactive Text Alerts and Campaigns for Financial Services   Join Glia for the premier customer interaction event - DCS Summit 2023Learn MoreSolutionsBy KPISalesDrive more sales onlineCustomer ExperienceIncrease customer loyaltyModernize SupportEase customer effortBy functionDigital CentricI support customers onlinePhone CentricI support customers via phoneHome AgentsCustomer Service from AnywhereVideo BankingPersonalized & expert service at a distancePlatformservices & SECURITYNew apps. New features. New ways to create. It's everythingChannelLessFocus on the full customer engagementCoBrowsingObserve and collaboratively guide visitors on-screenSMSMake SMS part of a seamless digital experienceAI ManagementManage customer chatbots and virtual agent assistantsVoiceEngage via traditional phone or seamless OnScreen VoiceAppletsUnified agent desktop for efficiency and satisfactionVideo ChatBuild trust with face-to-face conversations onlineChatSecure live and bot-assisted messaging with collaborationWorkforce ManagementRight reps, right channels at the right timeservices WhiteGlove Customer SuccessOnboarding and customer guidanceSECURITYSecuritySecurity at the coreIndustriesBankingBring the personalized in-branch experience onlineCredit UnionsEnhance the member experienceFinTechRevolutionize customer communicationInsuranceImprove customer acquisition and satisfactionLendingSupport lender activitiesSmall Business BankingGuided lending and customer serviceCompanyAbout GliaWho's behind Digital-First Customer Service?Glia's PhilosophyCCHaMP - Because excellence is a verbDigital Customer Service DefinedThe what and why of DCSAwardsWinning digital-first service technologyNewsNews from and about GliaBlogEducation, information, postulationPartnersPartner With GliaContact UsReach out to usWe're Hiring!Join the teamDiversity, Equity, and InclusionLearn about our DEI ProgramResourcesCase StudiesGlia Digital Customer Service solutions in actionGuidesInteractive guides and infographicsEbooks & White PapersLight reading to advance your DCS knowledgeResource LibraryBetter understand how to improve your cx through our collection of resourcesVideosAnimated explainers, client testimonials and on-demand webcastsWe're HiringRequest a DemoWe're Hiring!Request a DemoSMS GatewayInteractive Text Alerts and CampaignsUse SMS to enhance customer communication with proactive notifications, interactive marketing campaigns, and an alternative to the “On-Hold” waitBenefits of the SMS GatewayQuickly Reach Customers in the palm of their handProvide Timely Information and OffersReduce the Friction of EngagementWhy Add Outbound SMS?SMS is Fast and EverywhereSMS is fast, efficient, and ubiquitous. Most consumers have access to a mobile device with text messaging. For many (like a majority of millennials) texting is the communication channel of choice. So why not interact with your customers where they are most comfortable?Texts Get NoticedInbound SMS is a must today, but if you're not using outbound SMS in your customer support, loyalty and promotional efforts you're missing out. Recent statistics show that 98% of texts are opened and 90% are acted upon within three minutes. Imagine what that could mean for how you reach your customers and prospects.A World of PossibilitiesIntegrate outbound SMS text alerts with your business applications and marketing technology to power everything from proactive text alerts for security and account-related events to interactive contextual offers on a scheduled or triggered basis.So Much More Than Just TextingGlia's SMS Gateway enables you to achieve a new level of customer communications. Reach your customers in the palm of their hands and delight them with interactive engagements. Provide them the opportunity to seamlessly switch to even richer media such as voice or video with cobrowsing with just one tap.See The VideoSee The VideoImprove customer communications with SMS.Turn Outbound SMS into Two-Way ConversationsEnsure the “Important Stuff” is Noticed via Proactive AlertsYou can’t count on customers seeing an email or answering a call, but they do read and interact with texts. Send outbound SMS notifications on a scheduled basis (like a pending renewal) or by a triggered event such as unusual account activity. Clients can respond to text alerts when it's most convenient and interact with a chatbot powered by Glia's AI Management, or with one of your operators to quickly process transactions or resolve issues.Energize Your Marketing Campaigns with SMS Prospects and customers often shy away from unsolicited calls. Intrusive forms that are acted upon AFTER the visitor has forgotten you aren’t any better. These channels can limit your campaign effectiveness. Sending a promotional text to a valued customer, or inviting pay-per-click prospects to text you while the offer is still relevant, can make the difference between mediocrity and success.Give Callers a Better Alternative to “Please Hold”Nobody likes being stuck waiting to speak to a representative, but callbacks aren't always a practical solution. Phone-to-Text allows you to reduce friction and enhance the customer experience by giving callers the choice to opt-out in the IVR and seamlessly switch to SMS. Engagement can be automated by an intelligent Virtual Assistant or handled by your operators for the customized experience your clients desire.Gateway to a Seamless Digital First ExperienceLike every interaction within the Glia Digital First platform, your end-users can seamlessly switch from SMS to other channels like voice, video chat, and co-browsing without losing connection or context. Plus all interactions are securely tracked in the interaction database to ensure quality control and compliance.This is how it worksExplore the use casesSend Timely NotificationsSee also:Convert Phone Calls into Text ConversationsReinvent How You Serve Your CustomersRequest a Demo“With Glia we increased our conversion by over 200%”Director of Digital - Top 10 BankReinventing Customer ServiceHomeCompanyBlogPartnersCareersDEIResourcesDCS Summit PlatformsChannelLessCoBrowsingAI ManagementVideo ChatChatSMSServicesCustomer SuccessSecurityGlia SecurityBounty ProgramSolutionsIncrease SalesModernize SupportCustomer ExperienceDigital-CentricPhone-CentricHome AgentsVideo Banking© Glia Technologies, Inc. All rights reserved.Privacy Policy   I  Terms of Service   I  Security  I  Accessibility  "
35,deo dcs summit 2021 a look back,"deo dcs summit 2021 a look back. DCS Summit 2021 - A Look Back  Join Glia for the premier customer interaction event - DCS Summit 2023Learn MoreSolutionsBy KPISalesDrive more sales onlineCustomer ExperienceIncrease customer loyaltyModernize SupportEase customer effortBy functionDigital CentricI support customers onlinePhone CentricI support customers via phoneHome AgentsCustomer Service from AnywhereVideo BankingPersonalized & expert service at a distancePlatformservices & SECURITYNew apps. New features. New ways to create. It's everythingChannelLessFocus on the full customer engagementCoBrowsingObserve and collaboratively guide visitors on-screenSMSMake SMS part of a seamless digital experienceAI ManagementManage customer chatbots and virtual agent assistantsVoiceEngage via traditional phone or seamless OnScreen VoiceAppletsUnified agent desktop for efficiency and satisfactionVideo ChatBuild trust with face-to-face conversations onlineChatSecure live and bot-assisted messaging with collaborationWorkforce ManagementRight reps, right channels at the right timeservices WhiteGlove Customer SuccessOnboarding and customer guidanceSECURITYSecuritySecurity at the coreIndustriesBankingBring the personalized in-branch experience onlineCredit UnionsEnhance the member experienceFinTechRevolutionize customer communicationInsuranceImprove customer acquisition and satisfactionLendingSupport lender activitiesSmall Business BankingGuided lending and customer serviceCompanyAbout GliaWho's behind Digital-First Customer Service?Glia's PhilosophyCCHaMP - Because excellence is a verbDigital Customer Service DefinedThe what and why of DCSAwardsWinning digital-first service technologyNewsNews from and about GliaBlogEducation, information, postulationPartnersPartner With GliaContact UsReach out to usWe're Hiring!Join the teamDiversity, Equity, and InclusionLearn about our DEI ProgramResourcesCase StudiesGlia Digital Customer Service solutions in actionGuidesInteractive guides and infographicsEbooks & White PapersLight reading to advance your DCS knowledgeResource LibraryBetter understand how to improve your cx through our collection of resourcesVideosAnimated explainers, client testimonials and on-demand webcastsWe're HiringRequest a DemoWe're Hiring!Request a DemoEvent12:42DCS Summit 2021 - A Look Back Event12:42DCS Summit 2021 - A Look BackThe 2nd Annual DCS Summit was a big success with great speakers and hundreds of financial professionals all gathered together for one common purpose: OnScreen transformation of customer and member service. Our colleagues and guest speakers shared advice, best practices and lessons learned in the evolution from phone-based service to Digital Customer Service experiences. Their input was highly insightful and constructive:Ross Dalzell of Barclays talked about how financial institutions are often at the center of some of the most important moments in our lives, making the customer or member experience even more crucial. Corrie Carrigan of Bain & Company discussed the opportunities that are presented by implementing DCS with a focus on human-to-human interaction. She shared some eye-opening statistics that underscore how critical DCS and related processes are today. Laurie Bruggenwirth shared Ascentra Credit Union's journey from phone-based to OnScreen experiences. Glia team members shared the value that connecting OnScreen via Digital Customer Service provides to customers, companies, representatives, and beyondWatch the video above for key moments and takeaways, or read a recap of the event on the Glia blog.To learn more about how Digital Customer Service can expand your customer and member relationships, contact your Glia representative or request a personalized DCS demo.GliaWhat Jim is Reading and Listening To Right NowUltimate Guide to CoBrowsingJim’s Favorite New Product Outside of WorkAmazon EchoLatest VideosA Perfect Match: Digital Customer Service and the Call CenterDigital Customer Service for BanksGlia Call CenterReinventing Customer ServiceHomeCompanyBlogPartnersCareersDEIResourcesDCS Summit PlatformsChannelLessCoBrowsingAI ManagementVideo ChatChatSMSServicesCustomer SuccessSecurityGlia SecurityBounty ProgramSolutionsIncrease SalesModernize SupportCustomer ExperienceDigital-CentricPhone-CentricHome AgentsVideo Banking© Glia Technologies, Inc. All rights reserved.Privacy Policy   I  Terms of Service   I  Security  I  Accessibility  "
36,deo enhancing insurance servicing with video,"deo enhancing insurance servicing with video. Enhancing Insurance Interactions with Video  Join Glia for the premier customer interaction event - DCS Summit 2023Learn MoreSolutionsBy KPISalesDrive more sales onlineCustomer ExperienceIncrease customer loyaltyModernize SupportEase customer effortBy functionDigital CentricI support customers onlinePhone CentricI support customers via phoneHome AgentsCustomer Service from AnywhereVideo BankingPersonalized & expert service at a distancePlatformservices & SECURITYNew apps. New features. New ways to create. It's everythingChannelLessFocus on the full customer engagementCoBrowsingObserve and collaboratively guide visitors on-screenSMSMake SMS part of a seamless digital experienceAI ManagementManage customer chatbots and virtual agent assistantsVoiceEngage via traditional phone or seamless OnScreen VoiceAppletsUnified agent desktop for efficiency and satisfactionVideo ChatBuild trust with face-to-face conversations onlineChatSecure live and bot-assisted messaging with collaborationWorkforce ManagementRight reps, right channels at the right timeservices WhiteGlove Customer SuccessOnboarding and customer guidanceSECURITYSecuritySecurity at the coreIndustriesBankingBring the personalized in-branch experience onlineCredit UnionsEnhance the member experienceFinTechRevolutionize customer communicationInsuranceImprove customer acquisition and satisfactionLendingSupport lender activitiesSmall Business BankingGuided lending and customer serviceCompanyAbout GliaWho's behind Digital-First Customer Service?Glia's PhilosophyCCHaMP - Because excellence is a verbDigital Customer Service DefinedThe what and why of DCSAwardsWinning digital-first service technologyNewsNews from and about GliaBlogEducation, information, postulationPartnersPartner With GliaContact UsReach out to usWe're Hiring!Join the teamDiversity, Equity, and InclusionLearn about our DEI ProgramResourcesCase StudiesGlia Digital Customer Service solutions in actionGuidesInteractive guides and infographicsEbooks & White PapersLight reading to advance your DCS knowledgeResource LibraryBetter understand how to improve your cx through our collection of resourcesVideosAnimated explainers, client testimonials and on-demand webcastsWe're HiringRequest a DemoWe're Hiring!Request a Demosolution2:36 Enhancing Insurance Interactions with Video solution2:36 Enhancing Insurance Interactions with VideoInsurance carriers spend a significant amount of time and money driving traffic to their websites and encouraging online policy applications. Adding video engagement and Digital Customer Service can increase online sales conversions while maintaining a personal connection. With Digital Customer Service, representatives in an office, call center, or home office can serve customers using one- or two-way video as if they were in the same room. Seeing a representative during an interaction promotes trust and confidence. Further enhance interaction efficiencies by adding communication tools like CoBrowsing, messaging, voice, and AI. Watch the video to learn how next-generation video-enabled insurance interactions can promote satisfaction and conversions. Or, request a personalized demonstration to see firsthand how Glia is reinventing how insurance carriers support customers.GliaWhat Jim is Reading and Listening To Right NowUltimate Guide to CoBrowsingJim’s Favorite New Product Outside of WorkAmazon EchoLatest VideosA Perfect Match: Digital Customer Service and the Call CenterDigital Customer Service for BanksGlia Call CenterReinventing Customer ServiceHomeCompanyBlogPartnersCareersDEIResourcesDCS Summit PlatformsChannelLessCoBrowsingAI ManagementVideo ChatChatSMSServicesCustomer SuccessSecurityGlia SecurityBounty ProgramSolutionsIncrease SalesModernize SupportCustomer ExperienceDigital-CentricPhone-CentricHome AgentsVideo Banking© Glia Technologies, Inc. All rights reserved.Privacy Policy   I  Terms of Service   I  Security  I  Accessibility  "
37,deo dcs glia virtual assistants and q2,"deo dcs glia virtual assistants and q2. DCS, Glia Virtual Assistants, and Q2  Join Glia for the premier customer interaction event - DCS Summit 2023Learn MoreSolutionsBy KPISalesDrive more sales onlineCustomer ExperienceIncrease customer loyaltyModernize SupportEase customer effortBy functionDigital CentricI support customers onlinePhone CentricI support customers via phoneHome AgentsCustomer Service from AnywhereVideo BankingPersonalized & expert service at a distancePlatformservices & SECURITYNew apps. New features. New ways to create. It's everythingChannelLessFocus on the full customer engagementCoBrowsingObserve and collaboratively guide visitors on-screenSMSMake SMS part of a seamless digital experienceAI ManagementManage customer chatbots and virtual agent assistantsVoiceEngage via traditional phone or seamless OnScreen VoiceAppletsUnified agent desktop for efficiency and satisfactionVideo ChatBuild trust with face-to-face conversations onlineChatSecure live and bot-assisted messaging with collaborationWorkforce ManagementRight reps, right channels at the right timeservices WhiteGlove Customer SuccessOnboarding and customer guidanceSECURITYSecuritySecurity at the coreIndustriesBankingBring the personalized in-branch experience onlineCredit UnionsEnhance the member experienceFinTechRevolutionize customer communicationInsuranceImprove customer acquisition and satisfactionLendingSupport lender activitiesSmall Business BankingGuided lending and customer serviceCompanyAbout GliaWho's behind Digital-First Customer Service?Glia's PhilosophyCCHaMP - Because excellence is a verbDigital Customer Service DefinedThe what and why of DCSAwardsWinning digital-first service technologyNewsNews from and about GliaBlogEducation, information, postulationPartnersPartner With GliaContact UsReach out to usWe're Hiring!Join the teamDiversity, Equity, and InclusionLearn about our DEI ProgramResourcesCase StudiesGlia Digital Customer Service solutions in actionGuidesInteractive guides and infographicsEbooks & White PapersLight reading to advance your DCS knowledgeResource LibraryBetter understand how to improve your cx through our collection of resourcesVideosAnimated explainers, client testimonials and on-demand webcastsWe're HiringRequest a DemoWe're Hiring!Request a Demosolution2:28DCS, Glia Virtual Assistants, and Q2 solution2:28DCS, Glia Virtual Assistants, and Q2According to consumer research done by Rival Technologies, 53% of Gen Z and 42% of Millennials want to be able to find their answers entirely online. So, why is it that so much of customer service is still over the phone? As the new generations of banking customers and credit union members shift overall service preferences, savvy businesses need to learn to adapt to these ever-changing demands. At the Conversational Banking Summit 2021 hosted by Finn AI (now a part of Glia), Greg Varnell from Q2 and our own John Fernandez discussed how the digital experience has evolved for banks and credit unions. Hear them talk about how customer and member expectations have changed, what strategies they deploy to serve users in online spaces, and how virtual assistants can be used to greatly improve Digital Customer Service offerings.Learn more about AI-powered banking chatbots from Glia.Glia + Q2What Jim is Reading and Listening To Right NowUltimate Guide to CoBrowsingJim’s Favorite New Product Outside of WorkAmazon EchoLatest VideosA Perfect Match: Digital Customer Service and the Call CenterDigital Customer Service for BanksGlia Call CenterReinventing Customer ServiceHomeCompanyBlogPartnersCareersDEIResourcesDCS Summit PlatformsChannelLessCoBrowsingAI ManagementVideo ChatChatSMSServicesCustomer SuccessSecurityGlia SecurityBounty ProgramSolutionsIncrease SalesModernize SupportCustomer ExperienceDigital-CentricPhone-CentricHome AgentsVideo Banking© Glia Technologies, Inc. All rights reserved.Privacy Policy   I  Terms of Service   I  Security  I  Accessibility  "
